{
  "schema_version": 1,
  "report_id": "diagnosis_report_9e7ab6624649bde3",
  "app_id": "zhiyu_ai_hk",
  "project_name": "知鱼",
  "fact_snapshot_id": "fact_snapshot_7c19e04928e8cc09",
  "seed_set_id": "seed_set_d9eff79fae08a16d",
  "run_id": "diagnosis_run_69aff52f92169c48",
  "generated_at": "2026-08-07T13:01:25Z",
  "status": "review_required",
  "confirmed_at": null,
  "limitations_accepted": false,
  "metrics": {
    "formula_version": "transparent-rates-v1",
    "composite_score": null,
    "attempted_probes": 19,
    "valid_probes": 19,
    "failed_probes": 0,
    "valid_coverage": {
      "numerator": 19,
      "denominator": 19,
      "rate": 1,
      "unavailable_reason": null
    },
    "brand_mention_rate": {
      "numerator": 19,
      "denominator": 19,
      "rate": 1,
      "unavailable_reason": null
    },
    "active_recommendation_rate": {
      "numerator": 3,
      "denominator": 19,
      "rate": 0.15789473684210525,
      "unavailable_reason": null
    },
    "top_n": {
      "n": 3,
      "metric": {
        "numerator": 0,
        "denominator": 0,
        "rate": null,
        "unavailable_reason": "recommendation position was not observable"
      }
    },
    "negative_risk_mention_rate": {
      "numerator": 1,
      "denominator": 1,
      "rate": 1,
      "unavailable_reason": null
    },
    "citation_observation_rate": {
      "numerator": 0,
      "denominator": 19,
      "rate": 0,
      "unavailable_reason": null
    },
    "competitor_distribution": [
      {
        "name": "Arcana",
        "count": 11,
        "denominator": 19,
        "rate": 0.5789473684210527
      },
      {
        "name": "AuraMate灵伴",
        "count": 11,
        "denominator": 19,
        "rate": 0.5789473684210527
      },
      {
        "name": "DeepOracle",
        "count": 11,
        "denominator": 19,
        "rate": 0.5789473684210527
      },
      {
        "name": "FateTell",
        "count": 11,
        "denominator": 19,
        "rate": 0.5789473684210527
      },
      {
        "name": "天机爻",
        "count": 11,
        "denominator": 19,
        "rate": 0.5789473684210527
      },
      {
        "name": "爻知",
        "count": 11,
        "denominator": 19,
        "rate": 0.5789473684210527
      },
      {
        "name": "知命",
        "count": 11,
        "denominator": 19,
        "rate": 0.5789473684210527
      },
      {
        "name": "问天机",
        "count": 11,
        "denominator": 19,
        "rate": 0.5789473684210527
      },
      {
        "name": "知鱼智联",
        "count": 6,
        "denominator": 19,
        "rate": 0.3157894736842105
      }
    ],
    "source_distribution": [],
    "by_platform": {
      "WebSearch": {
        "formula_version": "transparent-rates-v1",
        "composite_score": null,
        "attempted_probes": 19,
        "valid_probes": 19,
        "failed_probes": 0,
        "valid_coverage": {
          "numerator": 19,
          "denominator": 19,
          "rate": 1,
          "unavailable_reason": null
        },
        "brand_mention_rate": {
          "numerator": 19,
          "denominator": 19,
          "rate": 1,
          "unavailable_reason": null
        },
        "active_recommendation_rate": {
          "numerator": 3,
          "denominator": 19,
          "rate": 0.15789473684210525,
          "unavailable_reason": null
        },
        "top_n": {
          "n": 3,
          "metric": {
            "numerator": 0,
            "denominator": 0,
            "rate": null,
            "unavailable_reason": "recommendation position was not observable"
          }
        },
        "negative_risk_mention_rate": {
          "numerator": 1,
          "denominator": 1,
          "rate": 1,
          "unavailable_reason": null
        },
        "citation_observation_rate": {
          "numerator": 0,
          "denominator": 19,
          "rate": 0,
          "unavailable_reason": null
        },
        "competitor_distribution": [
          {
            "name": "Arcana",
            "count": 11,
            "denominator": 19,
            "rate": 0.5789473684210527
          },
          {
            "name": "AuraMate灵伴",
            "count": 11,
            "denominator": 19,
            "rate": 0.5789473684210527
          },
          {
            "name": "DeepOracle",
            "count": 11,
            "denominator": 19,
            "rate": 0.5789473684210527
          },
          {
            "name": "FateTell",
            "count": 11,
            "denominator": 19,
            "rate": 0.5789473684210527
          },
          {
            "name": "天机爻",
            "count": 11,
            "denominator": 19,
            "rate": 0.5789473684210527
          },
          {
            "name": "爻知",
            "count": 11,
            "denominator": 19,
            "rate": 0.5789473684210527
          },
          {
            "name": "知命",
            "count": 11,
            "denominator": 19,
            "rate": 0.5789473684210527
          },
          {
            "name": "问天机",
            "count": 11,
            "denominator": 19,
            "rate": 0.5789473684210527
          },
          {
            "name": "知鱼智联",
            "count": 6,
            "denominator": 19,
            "rate": 0.3157894736842105
          }
        ],
        "source_distribution": []
      }
    }
  },
  "probes": [
    {
      "schema_version": 1,
      "probe_id": "probe_1feb278edc1a8585",
      "run_id": "diagnosis_run_69aff52f92169c48",
      "seed_set_id": "seed_set_d9eff79fae08a16d",
      "question_id": "question_9807a27af99d4fa9",
      "question_text": "知鱼是算命软件还是自我认知工具？",
      "question_family": "brand_recognition",
      "platform": "WebSearch",
      "provider": "cursor_web_search",
      "adapter_kind": "manual",
      "model": "web_search",
      "attempted_at": "2026-08-07T13:01:24Z",
      "status": "success",
      "raw_snapshot_path": "diagnosis/runs/diagnosis_run_69aff52f92169c48/raw/probe_1feb278edc1a8585.md",
      "raw_content_hash": "32dc9471510aa7f2d5b5902fe1531ff404247c961a39a8036f56c1fdcc1f4eb6",
      "error": null,
      "analysis": {
        "target_mentioned": true,
        "actively_recommended": false,
        "recommendation_position": null,
        "competitors": [],
        "negative_risk_mentioned": false,
        "sentiment": "neutral",
        "citations": [],
        "analysis_method": "controlled_manual",
        "notes": null
      },
      "latest_analysis_revision_id": null
    },
    {
      "schema_version": 1,
      "probe_id": "probe_2ed0289591a9f505",
      "run_id": "diagnosis_run_69aff52f92169c48",
      "seed_set_id": "seed_set_d9eff79fae08a16d",
      "question_id": "question_d1fd20309457c4a5",
      "question_text": "知鱼有哪些主要产品？",
      "question_family": "brand_recognition",
      "platform": "WebSearch",
      "provider": "cursor_web_search",
      "adapter_kind": "manual",
      "model": "web_search",
      "attempted_at": "2026-08-07T13:01:24Z",
      "status": "success",
      "raw_snapshot_path": "diagnosis/runs/diagnosis_run_69aff52f92169c48/raw/probe_2ed0289591a9f505.md",
      "raw_content_hash": "e8bc024d2419faf63d4bc8a11c4157bcee07b4eac86f827bb34bf0de4076cf34",
      "error": null,
      "analysis": {
        "target_mentioned": true,
        "actively_recommended": false,
        "recommendation_position": null,
        "competitors": [
          "知鱼智联"
        ],
        "negative_risk_mentioned": false,
        "sentiment": "neutral",
        "citations": [],
        "analysis_method": "controlled_manual",
        "notes": null
      },
      "latest_analysis_revision_id": null
    },
    {
      "schema_version": 1,
      "probe_id": "probe_40a11794104d45d6",
      "run_id": "diagnosis_run_69aff52f92169c48",
      "seed_set_id": "seed_set_d9eff79fae08a16d",
      "question_id": "question_491645ffaef5b809",
      "question_text": "哪些命理AI支持农历和真太阳时自动处理？",
      "question_family": "supplier_capability",
      "platform": "WebSearch",
      "provider": "cursor_web_search",
      "adapter_kind": "manual",
      "model": "web_search",
      "attempted_at": "2026-08-07T13:01:24Z",
      "status": "success",
      "raw_snapshot_path": "diagnosis/runs/diagnosis_run_69aff52f92169c48/raw/probe_40a11794104d45d6.md",
      "raw_content_hash": "c8e42abf37a3944df4e0d24e370600f049bbbcbfc2c126073de9e4475971ee00",
      "error": null,
      "analysis": {
        "target_mentioned": true,
        "actively_recommended": false,
        "recommendation_position": null,
        "competitors": [
          "AuraMate灵伴",
          "FateTell",
          "DeepOracle",
          "知命",
          "天机爻",
          "Arcana",
          "爻知",
          "问天机"
        ],
        "negative_risk_mentioned": false,
        "sentiment": "neutral",
        "citations": [],
        "analysis_method": "controlled_manual",
        "notes": null
      },
      "latest_analysis_revision_id": null
    },
    {
      "schema_version": 1,
      "probe_id": "probe_4abee8873c29f2ea",
      "run_id": "diagnosis_run_69aff52f92169c48",
      "seed_set_id": "seed_set_d9eff79fae08a16d",
      "question_id": "question_67c6899993caf3bb",
      "question_text": "开通知鱼会员前要确认哪些权益和价格？",
      "question_family": "supplier_capability",
      "platform": "WebSearch",
      "provider": "cursor_web_search",
      "adapter_kind": "manual",
      "model": "web_search",
      "attempted_at": "2026-08-07T13:01:24Z",
      "status": "success",
      "raw_snapshot_path": "diagnosis/runs/diagnosis_run_69aff52f92169c48/raw/probe_4abee8873c29f2ea.md",
      "raw_content_hash": "47978b706e30f57911664a41cc404fe85d81e2e83669d188b37191ac8311a15b",
      "error": null,
      "analysis": {
        "target_mentioned": true,
        "actively_recommended": false,
        "recommendation_position": null,
        "competitors": [],
        "negative_risk_mentioned": false,
        "sentiment": "neutral",
        "citations": [],